{
  "schema_version": "leva.et13.catalog.v1",
  "fixtures": [
    {
      "id": "web-today-available",
      "owner": "web",
      "distribution": "web",
      "route": "/?fixture=web-today-available",
      "ready_semantics_label": "ET13_READY:web-today-available",
      "surface_label": "web-today-available",
      "capture_scope": "body_projection",
      "source_widget": "TodayMissionSection",
      "substitutions": ["controller/provider state replaced by approved deterministic fixture"]
    },
    {
      "id": "web-path-current-week",
      "owner": "web",
      "distribution": "web",
      "route": "/?fixture=web-path-current-week",
      "ready_semantics_label": "ET13_READY:web-path-current-week",
      "surface_label": "web-path-current-week",
      "capture_scope": "body_projection",
      "source_widget": "MissionPathPlanView",
      "substitutions": ["controller/provider state replaced by approved deterministic fixture"]
    },
    {
      "id": "web-content-reading",
      "owner": "web",
      "distribution": "web",
      "route": "/?fixture=web-content-reading",
      "ready_semantics_label": "ET13_READY:web-content-reading",
      "surface_label": "web-content-reading",
      "capture_scope": "body_projection",
      "source_widget": "WebContentProjection",
      "substitutions": ["AdSense slot replaced by explicit offline blocked-network evidence slot"]
    },
    {
      "id": "web-workspace-idle",
      "owner": "web",
      "distribution": "web",
      "route": "/?fixture=web-workspace-idle",
      "ready_semantics_label": "ET13_READY:web-workspace-idle",
      "surface_label": "web-workspace-idle",
      "capture_scope": "body_projection",
      "source_widget": "SandboxLayout",
      "substitutions": ["controller state replaced by approved deterministic fixture", "Monaco callbacks disabled except production readiness"]
    },
    {
      "id": "web-review-loaded",
      "owner": "web",
      "distribution": "web",
      "route": "/?fixture=web-review-loaded",
      "ready_semantics_label": "ET13_READY:web-review-loaded",
      "surface_label": "web-review-loaded",
      "capture_scope": "component_projection",
      "source_widget": "WebReviewProjection",
      "substitutions": ["controller state replaced by approved deterministic fixture"]
    },
    {
      "id": "web-mentor-context-preview",
      "owner": "web",
      "distribution": "web",
      "route": "/?fixture=web-mentor-context-preview",
      "ready_semantics_label": "ET13_READY:web-mentor-context-preview",
      "surface_label": "web-mentor-context-preview",
      "capture_scope": "body_projection",
      "source_widget": "WebMentorContextProjection",
      "substitutions": ["controller/provider state replaced by approved deterministic fixture"]
    },
    {
      "id": "admin-kpi-dashboard",
      "owner": "admin",
      "distribution": "admin",
      "route": "/?fixture=admin-kpi-dashboard",
      "ready_semantics_label": "ET13_READY:admin-kpi-dashboard",
      "surface_label": "admin-kpi-dashboard",
      "capture_scope": "body_projection",
      "source_widget": "AdminKpiDashboardProjection",
      "substitutions": ["controller/provider state replaced by approved deterministic fixture"]
    },
    {
      "id": "admin-support-long-wire",
      "owner": "admin",
      "distribution": "admin",
      "route": "/?fixture=admin-support-long-wire",
      "ready_semantics_label": "ET13_READY:admin-support-long-wire",
      "surface_label": "admin-support-long-wire",
      "capture_scope": "component_projection",
      "source_widget": "AdminSupportDetailProjection",
      "substitutions": ["live provider and dialog shell replaced by deterministic AlertDialog host"]
    },
    {
      "id": "dp-design-mission-ledger",
      "owner": "dp_design",
      "distribution": "web",
      "route": "/?fixture=dp-design-mission-ledger",
      "ready_semantics_label": "ET13_READY:dp-design-mission-ledger",
      "surface_label": "dp-design-mission-ledger",
      "capture_scope": "component_projection",
      "source_widget": "DpEt13MissionLedgerFixture",
      "substitutions": ["hosted by the Flutter Web production distribution"]
    },
    {
      "id": "dp-design-context-payload-preview",
      "owner": "dp_design",
      "distribution": "web",
      "route": "/?fixture=dp-design-context-payload-preview",
      "ready_semantics_label": "ET13_READY:dp-design-context-payload-preview",
      "surface_label": "dp-design-context-payload-preview",
      "capture_scope": "component_projection",
      "source_widget": "DpEt13ContextPayloadPreviewFixture",
      "substitutions": ["hosted by the Flutter Web production distribution"]
    },
    {
      "id": "web-community-free",
      "owner": "web",
      "distribution": "web",
      "route": "/?fixture=web-community-free",
      "ready_semantics_label": "ET13_READY:web-community-free",
      "surface_label": "web-community-free",
      "capture_scope": "body_projection",
      "source_widget": "WebCommunityBoardProjection",
      "substitutions": ["controller/provider state replaced by approved deterministic fixture"]
    },
    {
      "id": "web-community-qna",
      "owner": "web",
      "distribution": "web",
      "route": "/?fixture=web-community-qna",
      "ready_semantics_label": "ET13_READY:web-community-qna",
      "surface_label": "web-community-qna",
      "capture_scope": "body_projection",
      "source_widget": "WebCommunityBoardProjection",
      "substitutions": ["controller/provider state replaced by approved deterministic fixture"]
    },
    {
      "id": "web-community-feedback",
      "owner": "web",
      "distribution": "web",
      "route": "/?fixture=web-community-feedback",
      "ready_semantics_label": "ET13_READY:web-community-feedback",
      "surface_label": "web-community-feedback",
      "capture_scope": "body_projection",
      "source_widget": "WebCommunityBoardProjection",
      "substitutions": ["controller/provider state replaced by approved deterministic fixture"]
    }
  ],
  "projection_contract_version": "leva.et13.projection-contract.v1",
  "projection_matrix": [
    {
      "fixture_id": "web-today-available",
      "capture_scope": "body_projection",
      "source_widget": "TodayMissionSection",
      "substitutions": ["controller/provider state replaced by approved deterministic fixture"]
    },
    {
      "fixture_id": "web-path-current-week",
      "capture_scope": "body_projection",
      "source_widget": "MissionPathPlanView",
      "substitutions": ["controller/provider state replaced by approved deterministic fixture"]
    },
    {
      "fixture_id": "web-content-reading",
      "capture_scope": "body_projection",
      "source_widget": "WebContentProjection",
      "substitutions": ["AdSense slot replaced by explicit offline blocked-network evidence slot"]
    },
    {
      "fixture_id": "web-workspace-idle",
      "capture_scope": "body_projection",
      "source_widget": "SandboxLayout",
      "substitutions": ["controller state replaced by approved deterministic fixture", "Monaco callbacks disabled except production readiness"]
    },
    {
      "fixture_id": "web-review-loaded",
      "capture_scope": "component_projection",
      "source_widget": "WebReviewProjection",
      "substitutions": ["controller state replaced by approved deterministic fixture"]
    },
    {
      "fixture_id": "web-mentor-context-preview",
      "capture_scope": "body_projection",
      "source_widget": "WebMentorContextProjection",
      "substitutions": ["controller/provider state replaced by approved deterministic fixture"]
    },
    {
      "fixture_id": "admin-kpi-dashboard",
      "capture_scope": "body_projection",
      "source_widget": "AdminKpiDashboardProjection",
      "substitutions": ["controller/provider state replaced by approved deterministic fixture"]
    },
    {
      "fixture_id": "admin-support-long-wire",
      "capture_scope": "component_projection",
      "source_widget": "AdminSupportDetailProjection",
      "substitutions": ["live provider and dialog shell replaced by deterministic AlertDialog host"]
    },
    {
      "fixture_id": "dp-design-mission-ledger",
      "capture_scope": "component_projection",
      "source_widget": "DpEt13MissionLedgerFixture",
      "substitutions": ["hosted by the Flutter Web production distribution"]
    },
    {
      "fixture_id": "dp-design-context-payload-preview",
      "capture_scope": "component_projection",
      "source_widget": "DpEt13ContextPayloadPreviewFixture",
      "substitutions": ["hosted by the Flutter Web production distribution"]
    },
    {
      "fixture_id": "web-community-free",
      "capture_scope": "body_projection",
      "source_widget": "WebCommunityBoardProjection",
      "substitutions": ["controller/provider state replaced by approved deterministic fixture"]
    },
    {
      "fixture_id": "web-community-qna",
      "capture_scope": "body_projection",
      "source_widget": "WebCommunityBoardProjection",
      "substitutions": ["controller/provider state replaced by approved deterministic fixture"]
    },
    {
      "fixture_id": "web-community-feedback",
      "capture_scope": "body_projection",
      "source_widget": "WebCommunityBoardProjection",
      "substitutions": ["controller/provider state replaced by approved deterministic fixture"]
    }
  ],
  "projection_contract_sha256": "158fdc882238c9459995c0572536a3cec3704e92bd1b28fa2d80907fc0435b78",
  "visual_matrix": {
    "widths": [320, 600, 840, 1240],
    "themes": ["light", "dark"],
    "height": 900,
    "device_pixel_ratio": 1,
    "text_scale_percent": 100,
    "locale": "ko-KR",
    "timezone": "UTC",
    "reduced_motion": true
  },
  "a11y_matrix": [
    {
      "width": 320,
      "theme": "light",
      "text_scale_percent": 200
    },
    {
      "width": 1240,
      "theme": "dark",
      "text_scale_percent": 200
    }
  ],
  "baseline_status": "pending_external_review"
}
